{
  "$schema": "https://json-schema.org/draft/2020-12/schema",
  "title": "Stage delivery manifest v1",
  "type": "object",
  "additionalProperties": false,
  "required": [
    "schema_version",
    "plan_group",
    "generated_at",
    "files",
    "image_format",
    "approval_status"
  ],
  "properties": {
    "schema_version": {
      "const": 1
    },
    "plan_group": {
      "enum": [
        "week1-2",
        "week3",
        "week4",
        "week3-4"
      ]
    },
    "generated_at": {
      "type": "string",
      "pattern": "^\\d{4}-\\d{2}-\\d{2}T\\d{2}:\\d{2}:\\d{2}(?:\\.\\d+)?\\+08:00$",
      "format": "date-time"
    },
    "files": {
      "type": "array",
      "minItems": 1,
      "items": {
        "type": "object",
        "additionalProperties": false,
        "required": [
          "path",
          "size",
          "sha256"
        ],
        "properties": {
          "path": {
            "type": "string",
            "pattern": "^(?!/)(?![A-Za-z]:)(?!.*//)(?!.*(?:^|/)\\.{1,2}(?:/|$))[^\\\\\\u0000-\\u001f]+$"
          },
          "size": {
            "type": "integer",
            "minimum": 0
          },
          "sha256": {
            "type": "string",
            "pattern": "^[0-9a-f]{64}$"
          }
        }
      }
    },
    "image_format": {
      "const": "M7IM-v1"
    },
    "approval_status": {
      "const": "pending-teacher-review"
    }
  }
}
