{
  "schema_version": 1,
  "plan_group": "week3-4",
  "generated_at": "2026-10-25T16:25:57.971860+08:00",
  "files": [
    {
      "path": "README.txt",
      "size": 25,
      "sha256": "AAAAAAAAAAAAAAAAAAAAAAAAAAAAAAAAAAAAAAAAAAAAAAAAAAAAAAAAAAAAAAAA"
    }
  ],
  "image_format": "M7IM-v1",
  "approval_status": "pending-teacher-review"
}
