{
  "schema_version": 1,
  "plan_group": "week3-4",
  "generated_at": "2026-10-24T17:31:11.391259+08:00",
  "files": [
    {
      "path": "firmware.bin",
      "size": 4,
      "sha256": "9f86d081884c7d659a2feaa0c55ad015a3bf4f1b2b0b822cd15d6c15b0f00a08"
    }
  ],
  "image_format": "M7IM-v1",
  "approval_status": "pending-teacher-review"
}